whisky_name,whisky_type,ratings,reviews_count,volume_alcohol_percentage,stock_flag,price,description,image_url,whisky_link
Suntory Kakubin Yellow Label,Blended Japanese Whisky,4.5,(7 Reviews),70cl / 40%,In Stock,£59.45,"Kakubin Yellow Label is Suntory's flagship blended whisky. Produced since 1937, its name means 'square bottle'. A blend of bourbon-cask whisky from Yamazaki and Hakushu, this is a classic example of lighter Japanese whisky and is great in a highball with soda.",https://img.thewhiskyexchange.com/900/japan_sun13.jpg,https://www.thewhiskyexchange.com/p/33964/suntory-kakubin-yellow-label
Suntory Hibiki Harmony 30th Anniversary Edition,Japanese Blended Whisky,5,(7 Reviews),70cl / 43%,In Stock,"£1,800","Hibiki has led the world of Japanese blended whisky since its creation in 1989, and this very-limited-edition release celebrates its 30th birthday.",https://img.thewhiskyexchange.com/900/japan_hib14.jpg,https://www.thewhiskyexchange.com/p/46904/suntory-hibiki-harmony-30th-anniversary-edition
Mars Maltage Cosmo,Japanese Blended Malt Whisky,4,(9 Reviews),70cl / 43%,In Stock,£55.95,"Cosmo from Mars Maltage is a blended malt that includes whisky from Shinshu in Japan. A big hit when released at the 2015 Tokyo International Bar Show, this is a permanent addition to the fledgling distillery's range.",https://img.thewhiskyexchange.com/900/japan_mar4.jpg,https://www.thewhiskyexchange.com/p/29679/mars-maltage-cosmo
Akashi 5 Year Old Sherry Cask Half Litre,Japanese Single Malt Whisky,5,(2 Reviews),50cl / 50%,In Stock,£150,"Akashi Single Malt Whisky is made at the White Oak distillery in the Hyogo prefecture. Matured for two years in sherry butts and three years in hogsheads, this is a lightly peated Japanese whisky.",https://img.thewhiskyexchange.com/900/japan_aka3.jpg,https://www.thewhiskyexchange.com/p/34461/akashi-5-year-old-sherry-cask-half-litre
Kaiyo Peated Mizunara Oak,Japanese Whisky,,,70cl / 46%,In Stock,£99.95,"A fruity, zesty and softly-smoky Japanese whisky, matured in mizunara oak casks. Aromas of orange peel, jasmine, soft cedar and coastal air fill the nose. The palate offers notes of earthy coffee, green apples, black tea and fresh herbs, with hints of cinnamon pastries and mango that linger in the finish.",https://img.thewhiskyexchange.com/900/japan_kai3.jpg,https://www.thewhiskyexchange.com/p/52590/kaiyo-peated-mizunara-oak
Nikka Tailored,,,,70cl / 43%,In Stock,£110,"Introduced to replace the beloved Nikka 12 Year Old, Tailored is a blend including malt whisky from Nikka's Yoichi and Miyagikyo distilleries and its Coffey Still grain. The whisky balances soft fruity notes with bitter notes of dark chocolate and citrus zest.",https://img.thewhiskyexchange.com/900/japan_nik57.jpg,https://www.thewhiskyexchange.com/p/56182/nikka-tailored
Togouchi Premium Blended Whisky,Japanese Blended Whisky,4.5,(10 Reviews),70cl / 40%,In Stock,£45.25,"Although blended in Japan, Togouchui Premium Whisky is a blend of Scottish malt and Canadian grain. Aged in the town of Togouchi in a tunnel that was originally built for a railway but never used - intriguing!",https://img.thewhiskyexchange.com/900/japan_tog1.jpg,https://www.thewhiskyexchange.com/p/24587/togouchi-premium-blended-whisky
Yamazaki Bourbon Barrel,Japanese Single Malt Whisky,,,70cl / 48.2%,In Stock,"£1,500","One of just 3,000 bottles released to the European market, this is a honeyed single malt with notes of vanilla, cinnamon and walnut. The whisky in this bottling has been aged in ex-bourbon barrels for between 10 to 15 years.",https://img.thewhiskyexchange.com/900/japan_yam42.jpg,https://www.thewhiskyexchange.com/p/34928/yamazaki-bourbon-barrel
Mars Kasei Blended Whisky,Japanese Blended Malt Whisky,5,(2 Reviews),70cl / 40%,In Stock,£42.95,"Mars Kasei blended whisky is a soft, rounded whisky from Shinshu distillery in Japan. The nose is full of gentle white flower aromas and notes of sweet, ripe fruits, while the palate offers notes of warm spices, green apples, white grapes and honey.",https://img.thewhiskyexchange.com/900/japan_mar8.jpg,https://www.thewhiskyexchange.com/p/48272/mars-kasei-blended-whisky
The Tottori Blended Kurayoshi,Blended Japanese Whisky,,,70cl / 43%,In Stock,£42.95,"The flagship expression in Kurayoshi's Tottori range is a blended Japanese whisky with aromas of cream, lemon sponge cake and pine needles, complemented by notes of seeded brown bread, black pepper, almond and soft smoke throughout the palate.",https://img.thewhiskyexchange.com/900/japan_kur4.jpg,https://www.thewhiskyexchange.com/p/62327/the-tottori-blended-kurayoshi
Suntory Toki Glass Pack,Japanese Blended Whisky,,,70cl / 43%,In Stock,£34.95,"A lovely gift set from Suntory, including a bottle of Toki whisky and a stylish highball glass. Toki is a blended whisky from Suntory's three distilleries: Yamazaki, Hakushu and Chita. This is a round and sweet blend with a refreshing citrus character and a spicy finish.",https://img.thewhiskyexchange.com/900/japan_sun34.jpg,https://www.thewhiskyexchange.com/p/57521/suntory-toki-glass-pack
Kaiyo Mizunara Oak Cask Strength,Japanese Whisky,5,(3 Reviews),70cl / 53%,In Stock,£110,"This is cask-strength edition of Kaiyo's Mizunara matured whisky. It's a rare beast, as there's not much Mizunara – Japanese oak – and only a tiny amount gets turned into whisky casks. It's worth the effort, as it adds a distinctly Japanese edge to the whisky, layering on incense-laden spiciness. Kaiyo go even further, shipping their casks out to sea for months before bottling to give them a gentle rock on the waves, getting even more flavour out of the wood.",https://img.thewhiskyexchange.com/900/japan_kai2.jpg,https://www.thewhiskyexchange.com/p/45367/kaiyo-mizunara-oak-cask-strength
Nikka Days,,5,(2 Reviews),70cl / 40%,In Stock,£39.95,"A vibrant addition to the Nikka range, Nikka Days is a bright and vivacious blend of malt and grain whiskies from distilleries including both Yoichi and Miyagikyo. Its medium body hosts an array of floral and zesty flavours which mingle effortlessly with an underlying vanilla-toffee depth and a light, distant touch of breezy peat smoke. A fresh and delicate whisky, Days makes a delicious sipping dram or sits beautifully in a refreshing highball.",https://img.thewhiskyexchange.com/900/japan_nik47.jpg,https://www.thewhiskyexchange.com/p/45577/nikka-days
Yamazakura Black Label Whisky,Japanese Blended Whisky,,,70cl / 40%,In Stock,£54.95,Yamazakura Black Label is a ji-whisky (made by a small distiller). This blended whisky was introduced in 2015 and is rarely seen outside Japan. Spicy with a hint of sweetness.,https://img.thewhiskyexchange.com/900/japan_yam45.jpg,https://www.thewhiskyexchange.com/p/37570/yamazakura-black-label-whisky
Nikka Taketsuru Pure Malt 2020 Release,Japanese Blended Malt Whisky,5,(1 Review),70cl / 43%,In Stock,£61.95,"The 2020 release of Nikka Taketsuru blended malt whisky is a smoky, full-bodied whisky with notes of rich oak spice, aromatic peat and sweet flowers throughout the palate.",https://img.thewhiskyexchange.com/900/japan_tak13.jpg,https://www.thewhiskyexchange.com/p/56192/nikka-taketsuru-pure-malt-2020-release
Akashi Red,Japanese Blended Whisky,4,(1 Review),50cl / 40%,In Stock,£30.45,"Akashi Red is made at the Eigashima (aka White Oak) distillery, which was founded in 1888. Produced by Akashi, this is a light and fruity whisky with notes of peach, almond and grape.",https://img.thewhiskyexchange.com/900/japan_aka4.jpg,https://www.thewhiskyexchange.com/p/37326/akashi-red
Yamazakura 963 8 Year Old,Japanese Blended Whisky,5,(2 Reviews),70cl / 59%,In Stock,£77.95,"A subtly spicy blended whisky from Japan, with notes of orchard fruits and caramel.",https://img.thewhiskyexchange.com/900/japan_yam47.jpg,https://www.thewhiskyexchange.com/p/39376/yamazakura-963-8-year-old
Togouchi Whisky 12 Year Old,Japanese Blended Whisky,4.5,(2 Reviews),70cl / 40%,In Stock,£81.25,"Togouchi's ageing warehouse must be one of the world's most unusual – it is an old railway tunnel in the eponymous town that was never used. This is the 12 year old, a blend of Scottish malt and Canadian grain that's fruity and citrus-rich.",https://img.thewhiskyexchange.com/900/japan_tog2.jpg,https://www.thewhiskyexchange.com/p/28520/togouchi-whisky-12-year-old
Akashi Single Malt Whisky,Japanese Single Malt Whisky,5,(1 Review),50cl / 46%,In Stock,£73.75,"Akashi Single Malt Whisky is made at the White Oak distillery in the Hyogo prefecture. Producing using lightly peated barley and aged in three different types of cask, this is the brand's flagship malt.",https://img.thewhiskyexchange.com/900/japan_aka2.jpg,https://www.thewhiskyexchange.com/p/31531/akashi-single-malt-whisky
Kaiyo Mizunara Oak,Japanese Whisky,5,(2 Reviews),70cl / 43%,In Stock,£82.95,"Kaiyo's stock of Mizunara oak casks is its pride and joy. Known to impart a subtle and unusual collection of aromas and flavours to whisky during maturation, it's this wood which is often credited with setting Japanese whisky apart. Kaiyo doubles down on its cask maturation, sending the full casks off to sea for months at a time, allowing the natural motion to ensure constant movement, and thus contact between whisky and wood.",https://img.thewhiskyexchange.com/900/japan_kai1.jpg,https://www.thewhiskyexchange.com/p/45366/kaiyo-mizunara-oak
Enso Japanese Whisky,Japanese Blended Whisky,,,70cl / 40%,In Stock,£55.95,"A delicate Japanese blended whisky from Kiyokawa, in Kanagawa Prefecture, Enso has been distilled using pot stills and matured in American oak casks. Aromas of lemon blossom, orange zest, vanilla, caramel and soft smoke fills the nose, complemented by notes of toasted oak, crunchy apples, cinnamon, woody vanilla and honeysuckle on the palate. Enjoy this whisky neat or as part of your favourite cocktail.",https://img.thewhiskyexchange.com/900/japan_ens1.jpg,https://www.thewhiskyexchange.com/p/57245/enso-japanese-whisky
Akashi Blended Whisky,,3.5,(19 Reviews),50cl / 40%,In Stock,£32.95,"A lesser-known whisky outside the local Japanese market, this version of Akashi is specially produced for the European market using a mixture of Japanese and foreign-made malt and grain whisky to produce a reasonably priced everyday blend.",https://img.thewhiskyexchange.com/900/japan_aka1.jpg,https://www.thewhiskyexchange.com/p/16917/akashi-blended-whisky
Karuizawa 1984 28 Year Old Cocktail Series,Japanese Single Malt Whisky,,,70cl / 59.3%,In Stock,"£8,000",,https://img.thewhiskyexchange.com/900/japan_kar1984v7.jpg,https://www.thewhiskyexchange.com/p/28575/karuizawa-1984-28-year-old-cocktail-series
Nikka Pure Malt White,,4.5,(3 Reviews),50cl / 43%,In Stock,£150,"A very endearing, subtle malt with a strong whiff of peat, this is a curious but superb marriage of different Japanese malts – and it really delivers. Brilliant.",https://img.thewhiskyexchange.com/900/japan_nik4.jpg,https://www.thewhiskyexchange.com/p/2932/nikka-pure-malt-white
Tokinoka White Blended Whisky,Japanese Blended Whisky,,,50cl / 40%,In Stock,£32.95,"A Japanese blended whisky from White Oak distillery, Tokinoka White has delicate white chocolate and floral notes, alongside maple syrup, green apples and fiery pink peppercorn.",https://img.thewhiskyexchange.com/900/japan_tok2.jpg,https://www.thewhiskyexchange.com/p/49001/tokinoka-white-blended-whisky
Miyagikyo 10 Year Old,Japanese Single Malt Whisky,,,70cl / 45%,In Stock,£450,"A soft, clean, sweetly fruity and extremely approachable Japanese malt from the Miyagikyo distillery in Sendai, northern Japan.",https://img.thewhiskyexchange.com/900/japan_miy1.jpg,https://www.thewhiskyexchange.com/p/2924/miyagikyo-10-year-old
Karuizawa 1984 First Fill Sherry Cask #4021,Japanese Single Malt Whisky,,,70cl / 64.5%,In Stock,"£9,500","Another enormously potent first fill sherry cask from Karuizawa, this was distilled in 1984 and displays very big earthy savoury notes, overcooked Dundee cake, leathery fruit and a hint of smoke. At 64.5% a drop of water (or four) is perfectly acceptable, but we actually preferred this one neat.",https://img.thewhiskyexchange.com/900/japan_kar1984.jpg,https://www.thewhiskyexchange.com/p/17994/karuizawa-1984-first-fill-sherry-cask-4021
Karuizawa Spirit of Asama 55%,Japanese Single Malt Whisky,4,(3 Reviews),70cl / 55%,In Stock,"£2,000","A exclusive bottling of whisky from Karuizawa for TWE, part of a vatting from about 77 casks and bottled at 55%. It's a different prospect to the various single casks that shoot off the shelves, offering a great tasting overview of the distillery's character unencumbered by decades of sherry-cask maturation.",https://img.thewhiskyexchange.com/900/japan_asa2.jpg,https://www.thewhiskyexchange.com/p/18100/karuizawa-spirit-of-asama-55
Suntory Hibiki 12 Year Old Half Litre,Blended Japanese Whisky,5,(14 Reviews),50cl / 43%,In Stock,£550,"A 50cl bottle of Suntory's excellent Hibiki 12yo, the starting point of the Hibiki range. It's a fantastic example of a Japanese style blended whisky: sweet and perfumed. Along with grain from Chita and malt from Yamazaki they use some whisky matured in plum wine casks in the mix.",https://img.thewhiskyexchange.com/900/japan_hib9.jpg,https://www.thewhiskyexchange.com/p/20331/suntory-hibiki-12-year-old-half-litre
Miyagikyo 15 Year Old,Japanese Single Malt Whisky,4,(1 Review),70cl / 40%,In Stock,"£1,000",A top-quality malt from the Miyagikyo distillery (also sometimes known as Sendai). A previous batch of this managed a hugely impressive 92 points from Jim Murray.,https://img.thewhiskyexchange.com/900/japan_miy3.jpg,https://www.thewhiskyexchange.com/p/2926/miyagikyo-15-year-old
Karuizawa 30 Year Old Aika Geisha Sherry Cask #5347,Japanese Single Malt Whisky,,,70cl / 58.2%,In Stock,"£25,000","The sherried half of a pair of Karuizawas launched at The Whisky Show 2014. Hugely popular, the tasting bottles were emptied in the first few minutes of each day of the show and the whisky sold out not long after. An intense, savoury and spicy whisky.",https://img.thewhiskyexchange.com/900/japan_kar20.jpg,https://www.thewhiskyexchange.com/p/26135/karuizawa-30-year-old-aika-geisha-sherry-cask-5347
Hanyu 1990 Queen of Hearts Cask #9102,Japanese Single Malt Whisky,,,70cl / 54.6%,In Stock,"£25,000","One of a series of really terrific Japanese malts from the sadly now defunct Hanyu distillery. Bursting with character and complexity, these masterpieces from a 'lost' distillery are pricey, but well worth it. A massive hit at this year's Whisky Live.",https://img.thewhiskyexchange.com/900/japan_han2.jpg,https://www.thewhiskyexchange.com/p/5795/hanyu-1990-queen-of-hearts-cask-9102
SMWS 116.1 (Yoichi) 1986 16 Year Old,Japanese Single Malt Whisky,,,70cl / 56.6%,In Stock,"£5,000",,https://img.thewhiskyexchange.com/900/japan_smws_116.1.jpg,https://www.thewhiskyexchange.com/p/18547/smws-1161-yoichi-1986-16-year-old
Hanyu 1985 The Joker Monochrome Label,Single Malt Japanese Whisky,,,70cl / 54.9%,In Stock,"£60,000","The last and final release from the Ichiro's Malt Card series bottlings from the closed Hanyu distillery. The Joker ""Monochrome"", perhaps is the rarest and most sought after from this legendary series.",https://img.thewhiskyexchange.com/900/japan_han1985.jpg,https://www.thewhiskyexchange.com/p/25880/hanyu-1985-the-joker-monochrome-label
Hanyu 2000 Final Vintage 15 Year Old Ichiro's Malt,Japanese Single Malt Whisky,,,70cl / 46.5%,In Stock,"£1,750",A special release from Ichiro Akuto - a single cask bottling of whisky from the final year of Hanyu distiller's operation. Bottled at 15 years of age and at cask strength without colouring or chill-filtration. A little slice of distilling history.,https://img.thewhiskyexchange.com/900/japan_han2000v9.jpg,https://www.thewhiskyexchange.com/p/32591/hanyu-2000-final-vintage-15-year-old-ichiros-malt
Karuizawa Spirit of Asama 48%,Japanese Single Malt Whisky,,,70cl / 48%,In Stock,"£1,750","A TWE exclusive release of Karuizawa, part of a vatting of 77 sherry casks bottled at 48% to produce a well rounded and affordable example of the distillery's character. The casks used for Spirit of Asama were filled in 1999 & 2000.",https://img.thewhiskyexchange.com/900/japan_asa1.jpg,https://www.thewhiskyexchange.com/p/18099/karuizawa-spirit-of-asama-48
Yoichi 20 Year Old,Japanese Single Malt Whisky,5,(3 Reviews),70cl / 52%,In Stock,"£3,000",A powerful cask-strength 20-year-old single malt from the Yoichi distillery that previously bested some very high-profile Scottish malts at a blind tasting in 2003 and received 95 points in Jim Murray's Whisky Bible.,https://img.thewhiskyexchange.com/900/japan_yoi4.jpg,https://www.thewhiskyexchange.com/p/2947/yoichi-20-year-old
Suntory Hibiki Harmony 2021 Limited Edition Design,Japanese Blended Whisky,,,70cl / 43%,,£199,"The 2021 edition of Suntory's annual limited-edition Hibiki Japanese Harmony release, this year named Ryusui-Hyakka – One-Hundred Flowers and Flowing Water. These special editions combine Hibiki's elegant character with even more elegant and luxurious artwork to create a very special package that's a must for fans of the iconic Japanese blended whisky.",https://img.thewhiskyexchange.com/900/japan_hib19.jpg,https://www.thewhiskyexchange.com/p/54219/suntory-hibiki-harmony-2021-limited-edition-design
Suntory Hibiki 17 Year Old,Japanese Blended Whisky,4.5,(38 Reviews),70cl / 43%,In Stock,£550,"A fantastic Japanese blend, made with aged malt and grain whiskies from Suntory's three distilleries. Spicy and sophisticated, this is great for catching people out at blind tastings. Recently awarded a Gold 'Editor's Choice' award from Whisky Magazine and picked up the top prize in its category at the World Whisky Awards 2010.",https://img.thewhiskyexchange.com/900/japan_hib1.jpg,https://www.thewhiskyexchange.com/p/2923/suntory-hibiki-17-year-old
Ichiro's Malt MWR Mizunara Wood Reserve,Japanese Blended Malt Whisky,5,(4 Reviews),70cl / 46.5%,In Stock,£115,"The return of a legendary whisky from Ichiro Akuto, formerly of Hanyu distillery and now founder and distiller at Chichibu. This is a blend of malt whiskies from his extensive stocks, including whisky matured in mizunara – fragrant Japanese oak. Outstandingly rare, with only very limited amounts available to the whisky industry to use to make casks, mizunara is uniquely fragrant and adds a refined and almost incense-like air to this whisky.",https://img.thewhiskyexchange.com/900/japan_ich10.jpg,https://www.thewhiskyexchange.com/p/46186/ichiros-malt-mwr-mizunara-wood-reserve
Super Nikka Rare Old,,4.5,(10 Reviews),70cl / 43%,In Stock,£51.45,Super Rare Old is a famous Japanese blend from the Nikka company. This contains a high proportion of malt from the Yoichi and Miyagikyo distilleries.,https://img.thewhiskyexchange.com/900/japan_nik35.jpg,https://www.thewhiskyexchange.com/p/30377/super-nikka-rare-old
Hatozaki Pure Malt Japanese Whisky,Japanese Blended Whisky,5,(2 Reviews),70cl / 46%,In Stock,£47.45,"Named after the oldest stone lighthouse in Japan, Hatozaki Pure Malt Japanese whisky is a sweet, smoky blended malt whisky from Kaikyo distillery. Rich aromas of dried fruits, toffee apples and summer blossoms fill the nose, and the palate offers notes of sweet honey, delicate wood smoke and sultanas.",https://img.thewhiskyexchange.com/900/japan_hat2.jpg,https://www.thewhiskyexchange.com/p/49822/hatozaki-pure-malt-japanese-whisky
Hakushu Distiller's Reserve,Japanese Single Malt Whisky,4.5,(28 Reviews),70cl / 43%,In Stock,£66.95,"A green and crunchy entry in the Hakushu Range, combining whisky of a wide variety of ages, from across the range of casks used by the distillery to create a gently smoky dram, packed with fruity flavour.",https://img.thewhiskyexchange.com/900/japan_hak16.jpg,https://www.thewhiskyexchange.com/p/23771/hakushu-distillers-reserve
Suntory Hibiki Harmony,Japanese Blended Whisky,4,(56 Reviews),70cl / 43%,In Stock,£71.95,"Hibiki Japanese Harmony is a blend of Japanese malt and grain whiskies from Yamazaki, Hakushu and Chita. Presented in the brand's trademark 24-faceted bottle representing the Japanese seasons, this is light, approachable and moreish with enticing notes of orange peel and white chocolate.",https://img.thewhiskyexchange.com/900/japan_hib11.jpg,https://www.thewhiskyexchange.com/p/29388/suntory-hibiki-harmony
Yamazaki 12 Year Old,Japanese Single Malt Whisky,4.5,(90 Reviews),70cl / 43%,In Stock,£135,"One of the first Japanese single malts to break into the UK market, Suntory's Yamazaki 12 Year Old continues to impress with its well-balanced fruity sweetness, something that appeals to novice and experienced whisky drinkers alike.",https://img.thewhiskyexchange.com/900/japan_yam1.jpg,https://www.thewhiskyexchange.com/p/2940/yamazaki-12-year-old
Ichiro's Malt & Grain Japanese Whisky,Japanese Blended Whisky,4.5,(2 Reviews),70cl / 46.5%,In Stock,£69.95,"A blend from the king of independent Japanese distillers, Ichiro Akuto. In addition to whisky from his own Chichibu distillery, it also includes whiskies from America, Canada, Scotland and Ireland. As it says on the label – 'This is worldwide blended whisky'.",https://img.thewhiskyexchange.com/900/japan_ich13.jpg,https://www.thewhiskyexchange.com/p/48233/ichiros-malt-grain-japanese-whisky
The Nikka 12 Year Old,,5,(16 Reviews),70cl / 43%,In Stock,£125,"A blend including whisky from Nikka's two distilleries, Yoichi and Miyagikyo, The Nikka 12 is a well-balanced blend. There's green-apple freshness, rich fruitcake spiciness, butterscotch and some green-peppercorn punch. Another winner from Nikka.",https://img.thewhiskyexchange.com/900/japan_nik34.jpg,https://www.thewhiskyexchange.com/p/28580/the-nikka-12-year-old
Suntory Toki,Japanese Blended Whisky,4,(32 Reviews),70cl / 43%,In Stock,£31.95,"Toki is a blended whisky from Suntory's three distilleries: Yamazaki, Hakushu and Chita. This is a round and sweet blend with a refreshing citrus character and a spicy finish.",https://img.thewhiskyexchange.com/900/japan_sun15.jpg,https://www.thewhiskyexchange.com/p/36362/suntory-toki
Hatozaki Blended Japanese Whisky,Japanese Blended Whisky,3,(3 Reviews),70cl / 40%,In Stock,£29.95,"Named after the oldest stone lighthouse in Japan, Hatozaki blended whisky is made at Kaikyo distillery. Matured in a variety of casks, including sherry, bourbon and Mizunara oak it has a complex character, with notes of cherry blossom, pears and caramel throughout the palate.",https://img.thewhiskyexchange.com/900/japan_hat1.jpg,https://www.thewhiskyexchange.com/p/49821/hatozaki-blended-japanese-whisky
Nikka Pure Malt Red,,4.5,(3 Reviews),50cl / 43%,In Stock,£46.45,"Blended with Japanese malt from Nikka's Yoichi and Miyagikyo distilleries, this is clean, fruity and very easy to drink.",https://img.thewhiskyexchange.com/900/japan_nik8.jpg,https://www.thewhiskyexchange.com/p/2935/nikka-pure-malt-red
Miyagikyo Single Malt,Japanese Single Malt Whisky,4.5,(9 Reviews),70cl / 45%,In Stock,£75.95,"Nikka's entry-level whisky from Miyagikyo distillery. Light in body, yet full of flavour, this is an excellent introduction to Japanese whisky. Elegantly fruity with sherry-cask character.",https://img.thewhiskyexchange.com/900/japan_miy10.jpg,https://www.thewhiskyexchange.com/p/32762/miyagikyo-single-malt
Yoichi Single Malt,Japanese Single Malt Whisky,4.5,(8 Reviews),70cl / 45%,In Stock,£75.95,"Relaunched in 2016, this comes from Nikka's excellent Yoichi distillery. This is a blend of single malts from different years and consequently does not carry an age statement. This is a smoky whisky with a maritime character.",https://img.thewhiskyexchange.com/900/japan_yoi22.jpg,https://www.thewhiskyexchange.com/p/32761/yoichi-single-malt
Nikka Coffey Malt Whisky,Distillery Bottling,4.5,(40 Reviews),70cl / 45%,In Stock,£60.95,"Previously only released as part of single casks, Nikka decided to add their Coffey Malt to their core range in 2014. Distilled in a Coffey still normally used for grain whisky production, the malt is delightfully fruity and spicy.",https://img.thewhiskyexchange.com/900/japan_nik25.jpg,https://www.thewhiskyexchange.com/p/24156/nikka-coffey-malt-whisky
Hakushu 12 Year Old,Japanese Single Malt Whisky,4.5,(32 Reviews),70cl / 43%,In Stock,£175,"A perennial favourite and a must-try for anyone interested in discovering Japanese whisky. Hakushu is owned by Suntory, founders of the first Japanese distillery, Yamazaki. The original Hakushu distillery was built in 1973, with another distillery building called Hakushu Higashi (east) added in 1981.",https://img.thewhiskyexchange.com/900/japan_hak1.jpg,https://www.thewhiskyexchange.com/p/2922/hakushu-12-year-old
Ichiro's Malt Double Distilleries (46.5%),Japanese Blended Malt Whisky,4.5,(2 Reviews),70cl / 46.5%,In Stock,£115,"The newer, 46.5% version of a vatting of single malt from the Hanyu distillery built by Ichiro Akuto's grandfather with malt from the Chichibu distillery built nearby by Ichiro himself. A deliciously nutty dram.",https://img.thewhiskyexchange.com/900/japan_ich12.jpg,https://www.thewhiskyexchange.com/p/47669/ichiros-malt-double-distilleries-465
Ichiro's Malt Wine Wood Reserve,Japanese Blended Malt Whisky,5,(1 Review),70cl / 46.5%,In Stock,£115,"Ichiro Akuto, founder of Japan's Chichibu distillery, is not only one of the most respected distillers in the country, but he's also a master whisky blender. His Wine Wood Reserve is a blended malt containing Japanese whiskies from Chichibu that have been finished in red wine casks and Scottish whisky. The result is a rich and jammy dram with lots of complexity.",https://img.thewhiskyexchange.com/900/japan_ich11.jpg,https://www.thewhiskyexchange.com/p/46187/ichiros-malt-wine-wood-reserve
